{
    "$schema":  "../schemas/version_profile.schema.json",
    "schema_type":  "VersionProfile",
    "schema_version":  1,
    "enabled":  true,
    "id":  "st_gnu_tools_for_stm32_14_3_rel1",
    "display_name":  "GNU Tools for STM32 14.3.rel1",
    "family":  "st-gnu-tools-for-stm32",
    "selectors":  {
                      "tags":  [
                                   "14.3.rel1"
                               ],
                      "archive_roots":  [
                                            "gnu-tools-for-stm32-14.3.rel1"
                                        ],
                      "folder_name_patterns":  [
                                                   "gnu-tools-for-stm32-14.3.rel1*"
                                               ]
                  },
    "detection_hints":  [
                            {
                                "type":  "file_regex",
                                "path":  "build-common.sh",
                                "regex":  "PKGROOTNAME=\"GNU Tools for STM32\"",
                                "description":  "ST product marker in build-common.sh"
                            },
                            {
                                "type":  "file_regex",
                                "path":  "build-common.sh",
                                "regex":  "RELEASEVER=Rel1",
                                "description":  "Release level marker"
                            },
                            {
                                "type":  "file_regex",
                                "path":  "src/gcc/gcc/BASE-VER",
                                "regex":  "^14\\.3\\.1$",
                                "description":  "Base GCC version for the 14.3 release family"
                            },
                            {
                                "type":  "path_exists",
                                "path":  "src/binutils/ld/ldlang.c",
                                "description":  "Expected ld source layout exists"
                            }
                        ],
    "patch_recipe_id":  "json_patch_v10_st_ld_14_3_rel1",
    "build_recipe_ids":  [
                             "msys2_mingw64_st_ld_14_3_verified"
                         ],
    "verify_recipe_ids":  [
                              "sanity_cli",
                              "json_smoke_self_contained"
                          ],
    "priority":  90,
    "status":  "verified_local",
    "notes":  [
                  "This profile is routed by archive root, product markers, release level, and BASE-VER = 14.3.1.",
                  "Support is not assumed from the version string alone; the patch recipe still gates compatibility through anchor checks.",
                  "This profile is now locally verified for extract, apply, build, verify, and CubeIDE packaging on 14.3.rel1 in this workspace."
              ]
}
